{
  "extensions": {
    "lorebuddy-dnd2024-review": {
      "decision_scope": "accept claimed association or reject; never auto-verify",
      "previous_mapping": {
        "book_id": "mm-2025",
        "book_name": "怪物图鉴2025",
        "category": "core-2024",
        "entry_id": "urn:uuid:2cc417f9-b3ff-5e61-b655-2653f61642d2",
        "mapping_basis": "source_path_top_level_root",
        "mapping_status": "deterministic",
        "output_path": "Notes/怪物图鉴2025/元素/四元素/气元素.md",
        "source_identity_status": "claimed",
        "source_path": "怪物图鉴2025/元素/四元素/气元素.htm",
        "system_version": "2024",
        "title": "气元素"
      }
    }
  },
  "id": "urn:uuid:c8be1321-c4c1-5f9e-aa78-4411f9718000",
  "lifecycle": {
    "revision": 1,
    "status": "draft"
  },
  "mapping_status": "claimed",
  "review_status": "pending",
  "schema": "core.source-mapping@0.1.0",
  "source": {
    "id": "urn:uuid:2cc417f9-b3ff-5e61-b655-2653f61642d2",
    "kind": "entry"
  },
  "target": {
    "edition_id": "urn:uuid:9b7e4a00-7efd-5fd2-8236-f15e3716a155",
    "work_id": "urn:uuid:cc510ffb-c824-5afd-9b98-252f6d285089"
  }
}
